<?xml version="1.0" encoding="UTF-8"?>
<personas xmlns:xsi="http://www.w3.org/2001/XMLSchema-instance"
              xsi:noNamespaceSchemaLocation="personas.xsd">
  <persona>
  <nombre>Eva</nombre>
  <edad>25</edad>
  <pais>Francia</pais>
  <telefono>999888777</telefono>
</persona>
<persona>
  <nombre>Giorno</nombre>
  <edad>15</edad>
  <pais>Italia</pais>
  <telefono>11122233</telefono>
</persona>
</personas>